{
  "kind": "specialization_descriptor.v1",
  "version": "v1",
  "specialization_id": "<specialization-id>",
  "canonical_name": "<family>.<specialization-id>",
  "family": "<family>",
  "specialization_class": "general",
  "status": "active",
  "review_state": "managed",
  "verticalization_wave": "wave-x",
  "runtime": {
    "manifest_ref": "specializations/model/manifests/<specialization-id>/manifest.v1.json",
    "bundle_ref": "specializations/model/manifests/<specialization-id>",
    "scenario_classes": []
  },
  "composition": {
    "model_refs": [],
    "policy_refs": [],
    "evidence_refs": [],
    "authority_refs": [],
    "discovery_refs": [],
    "scenario_refs": []
  },
  "taxonomy": {
    "risk_ref": "model/taxonomy/risks/risk-taxonomy.v1.json",
    "action_ref": "model/taxonomy/actions/action-taxonomy.v1.json",
    "asset_ref": "model/taxonomy/assets/asset-taxonomy.v1.json",
    "signal_ref": "model/taxonomy/signals/signal-taxonomy.v1.json"
  }
}
