{
  "kind": "specialization_descriptor.v1",
  "version": "v1",
  "specialization_id": "experiment-configuration",
  "canonical_name": "scientific.experiment-configuration",
  "family": "scientific",
  "specialization_class": "general",
  "status": "active-planned",
  "review_state": "managed",
  "verticalization_wave": "",
  "runtime": {
    "manifest_ref": "specializations/model/manifests/experiment-configuration/manifest.v1.json",
    "bundle_ref": "specializations/model/manifests/experiment-configuration",
    "scenario_classes": [
      "sc.scientific.experiment-configuration.baseline",
      "sc.scientific.experiment-configuration.stress"
    ]
  },
  "composition": {
    "model_refs": [],
    "policy_refs": [],
    "evidence_refs": [],
    "authority_refs": [],
    "discovery_refs": [],
    "scenario_refs": []
  },
  "taxonomy": {
    "risk_ref": "model/taxonomy/risks/risk-taxonomy.v1.json",
    "action_ref": "model/taxonomy/actions/action-taxonomy.v1.json",
    "asset_ref": "model/taxonomy/assets/asset-taxonomy.v1.json",
    "signal_ref": "model/taxonomy/signals/signal-taxonomy.v1.json"
  },
  "source": {
    "generator": "tools/gen/build_specialization_descriptors.py",
    "materialized_bundle_ref": "specializations/model/manifests/experiment-configuration"
  }
}
