{
  "kind": "specialization_descriptor.v1",
  "version": "v1",
  "specialization_id": "treasury",
  "canonical_name": "economic.treasury",
  "family": "economic",
  "specialization_class": "general",
  "status": "active-seed",
  "review_state": "managed",
  "verticalization_wave": "wave-1-seed",
  "runtime": {
    "manifest_ref": "specializations/model/manifests/treasury/manifest.v1.json",
    "bundle_ref": "specializations/model/manifests/treasury",
    "scenario_classes": [
      "sc.economic.treasury.baseline",
      "sc.economic.treasury.stress"
    ]
  },
  "composition": {
    "model_refs": [
      "specializations/model/manifests/treasury/model/minimal.v1.json"
    ],
    "policy_refs": [
      "specializations/model/manifests/treasury/policy/minimal.v1.json"
    ],
    "evidence_refs": [
      "specializations/model/manifests/treasury/evidence/minimal.v1.json"
    ],
    "authority_refs": [],
    "discovery_refs": [],
    "scenario_refs": []
  },
  "taxonomy": {
    "risk_ref": "model/taxonomy/risks/risk-taxonomy.v1.json",
    "action_ref": "model/taxonomy/actions/action-taxonomy.v1.json",
    "asset_ref": "model/taxonomy/assets/asset-taxonomy.v1.json",
    "signal_ref": "model/taxonomy/signals/signal-taxonomy.v1.json"
  },
  "source": {
    "generator": "tools/gen/build_specialization_descriptors.py",
    "materialized_bundle_ref": "specializations/model/manifests/treasury"
  }
}
